{
  "eventId": "019b0000-0000-7000-8000-000000000005",
  "eventType": "event-delivery.dead-lettered.v1",
  "schemaVersion": 1,
  "occurredAt": "2026-07-21T12:10:00Z",
  "producer": "event-consumer",
  "tenantId": "019b0000-0000-7000-8000-000000000002",
  "projectId": "019b0000-0000-7000-8000-000000000003",
  "runId": "019b0000-0000-7000-8000-000000000004",
  "aggregateType": "EventDeliveryFailure",
  "aggregateId": "019b0000-0000-7000-8000-000000000006",
  "aggregateVersion": 1,
  "correlationId": "command-example",
  "causationId": "019b0000-0000-7000-8000-000000000001",
  "payload": {
    "originalEnvelope": {
      "eventId": "019b0000-0000-7000-8000-000000000001",
      "eventType": "agent-run.requested.v1",
      "schemaVersion": 1,
      "occurredAt": "2026-07-21T12:00:00Z",
      "producer": "platform-api",
      "tenantId": "019b0000-0000-7000-8000-000000000002",
      "projectId": "019b0000-0000-7000-8000-000000000003",
      "runId": "019b0000-0000-7000-8000-000000000004",
      "aggregateType": "AgentRun",
      "aggregateId": "019b0000-0000-7000-8000-000000000004",
      "aggregateVersion": 1,
      "correlationId": "command-example",
      "causationId": "command-example",
      "payload": {
        "projectId": "019b0000-0000-7000-8000-000000000003",
        "runId": "019b0000-0000-7000-8000-000000000004",
        "status": "QUEUED",
        "attemptNumber": 1,
        "runtime": "python-3.12",
        "cpuMillis": 1000,
        "memoryMiB": 2048,
        "timeoutSeconds": 1800,
        "maxAttempts": 3,
        "promptReference": "vault://prompts/example"
      }
    },
    "originalTopic": "agentforge.agent-run.lifecycle.retry.30m.v1",
    "originalPartition": 1,
    "originalOffset": 42,
    "originalKey": "019b0000-0000-7000-8000-000000000004",
    "consumerIdentity": "scheduler.v1",
    "failureCode": "DEPENDENCY_TIMEOUT",
    "failureReason": "dependency remained unavailable",
    "attempts": 4,
    "firstFailedAt": "2026-07-21T12:01:00Z",
    "lastFailedAt": "2026-07-21T12:10:00Z",
    "replayDisposition": "QUARANTINED"
  }
}
